,abstract,author,doi,journal,pdf_url,publication_date,title,url,year,index
553,"<p>We study a model in which perfectly informed experts offer advice to a decision maker whose actions affect the welfare of all. Experts are biased and thus may wish to pull the decision maker in different directions and to different degrees. When the decision maker consults only a single expert, the expert withholds substantial information from the decision maker. We ask whether this situation is improved by having the decision maker sequentially consult two experts. We first show that there is no perfect Bayesian equilibrium in which full revelation occurs. When both experts are biased in the same direction, it is never beneficial to consult both. In contrast, when experts are biased in opposite directions, it is always beneficial to consult both. Indeed, in this case full revelation may be induced in an extended debate by introducing the possibility of rebuttal.</p>","Krishna, Vijay Morgan, John",10.1162/00335530151144159,The Quarterly Journal of Economics,https://academic.oup.com/qje/article-pdf/116/2/747/5375310/116-2-747.pdf,2001/05/01,A Model of Expertise,https://academic.oup.com/qje/article/116/2/747/1904204/A-Model-of-Expertise,2001,273
554,"<p>This paper proposes an experimental approach to studying different aspects of discrimination. We let participants play various games with opponents of distinct ethnic affiliation. Strategies based upon such ethnic affiliation provide direct evidence of ethnic discrimination. This approach was utilized to study ethnic discrimination in Israeli Jewish society. Using the “trust game,” we detected a systematic mistrust toward men of Eastern origin. A “dictator game” experiment indicated that this discrimination was due to (mistaken) ethnic stereotypes and not to a “taste for discrimination.” The “ultimatum game” enabled us to trace another ethnic stereotype that reversed the discrimination's direction. One of the surprising results is that this ethnic discrimination is an entirely male phenomenon.</p>","Fershtman, Chaim Gneezy, Uri",10.1162/003355301556338,The Quarterly Journal of Economics,https://academic.oup.com/qje/article-pdf/116/1/351/5462367/116-1-351.pdf,2001/02/01,Discrimination in a Segmented Society: An Experimental Approach,https://academic.oup.com/qje/article/116/1/351/1939071/Discrimination-in-a-Segmented-Society-An,2001,274
556,"<p>This paper considers a simple “three-goods” model and focuses attention on the expectational stability of its equilibria. The setting allows us to describe stylized general equilibrium macro interactions: firms hire workers and then sell production to buyers whose purchasing power depends on the firms' previous decisions. We assess expectational stability from an “eductive” learning procedure that reflects basic rationality considerations. From our viewpoint on coordination, we compare the merits of fixed wages versus flexible wages. Although in both cases the same factors—supply and demand elasticities, marginal propensity to save—are effective, expectational coordination is often more successful with flexible wages.</p>","Guesnerie, Roger",10.1162/00335530152466322,The Quarterly Journal of Economics,https://academic.oup.com/qje/article-pdf/116/3/1115/5364599/116-3-1115.pdf,2001/08/01,Short-Run Expectational Coordination: Fixed Versus Flexible Wages,https://academic.oup.com/qje/article/116/3/1115/1899764/Short-Run-Expectational-Coordination-Fixed-Versus,2001,275
557,"<p>Although the college-high school wage gap for younger U. S. men has doubled over the past 30 years, the gap for older men has remained nearly constant. In the United Kingdom and Canada the college-high school wage gap also increased for younger relative to older men. Using a model with imperfect substitution between similarly educated workers in different age groups, we argue that these shifts reflect changes in the relative supply of highly educated workers across age groups. The driving force behind these changes is the slowdown in the rate of growth of educational attainment that began with cohorts born in the early 1950s in all three countries.</p>","Card, David Lemieux, Thomas",10.1162/00335530151144140,The Quarterly Journal of Economics,https://academic.oup.com/qje/article-pdf/116/2/705/5375301/116-2-705.pdf,2001/05/01,Can Falling Supply Explain the Rising Return to College for Younger Men? A Cohort-Based Analysis,https://academic.oup.com/qje/article/116/2/705/1904202/Can-Falling-Supply-Explain-the-Rising-Return-to,2001,276
558,<p>This paper uses data from a randomized housing-mobility experiment to study the effects of relocating families from high- to low-poverty neighborhoods on juvenile crime. Outcome measures come from juvenile arrest records taken from government administrative data. Our findings seem to suggest that providing families with the opportunity to move to lower-poverty neighborhoods reduces violent criminal behavior by teens.</p>,"Ludwig, Jens Duncan, Greg J. Hirschfield, Paul",10.1162/00335530151144122,The Quarterly Journal of Economics,https://academic.oup.com/qje/article-pdf/116/2/655/5375255/116-2-655.pdf,2001/05/01,Urban Poverty and Juvenile Crime: Evidence from a Randomized Housing-Mobility Experiment,https://academic.oup.com/qje/article/116/2/655/1904197/Urban-Poverty-and-Juvenile-Crime-Evidence-from-a,2001,277
559,"<p>This paper uses a unique data set to measure peer effects among college roommates. Freshman year roommates and dormmates are randomly assigned at Dartmouth College. I find that peers have an impact on grade point average and on decisions to join social groups such as fraternities. Residential peer effects are markedly absent in other major life decisions such as choice of college major. Peer effects in GPA occur at the individual room level, whereas peer effects in fraternity membership occur both at the room level and the entire dorm level. Overall, the data provide strong evidence for the existence of peer effects in student outcomes.</p>","Sacerdote, Bruce",10.1162/00335530151144131,The Quarterly Journal of Economics,https://academic.oup.com/qje/article-pdf/116/2/681/5375285/116-2-681.pdf,2001/05/01,Peer Effects with Random Assignment: Results for Dartmouth Roommates,https://academic.oup.com/qje/article/116/2/681/1904199/Peer-Effects-with-Random-Assignment-Results-for,2001,278
730,"<p>We examine short-run impacts of changes in residential neighborhoods on the well-being of families residing in high-poverty public housing projects who received Section 8 housing vouchers through a random lottery. Households offered vouchers experienced improvements in multiple measures of well-being relative to a control group, including increased safety, improved health among household heads, and fewer behavior problems among boys. There were no significant short-run impacts of vouchers on the employment, earnings, or welfare receipt of household heads. Children in households offered vouchers valid only in low poverty neighborhoods also had reduced likelihood of injuries, asthma attacks, and victimizations by crime.</p>","Katz, Lawrence F. Kling, Jeffrey R. Liebman, Jeffrey B.",10.1162/00335530151144113,The Quarterly Journal of Economics,https://academic.oup.com/qje/article-pdf/116/2/607/5375227/116-2-607.pdf,2001/05/01,Moving to Opportunity in Boston: Early Results of a Randomized Mobility Experiment,https://academic.oup.com/qje/article/116/2/607/1904187/Moving-to-Opportunity-in-Boston-Early-Results-of-a,2001,279
732,"<p>To what extent must nations cede control over their economic and social policies if global efficiency is to be achieved in an interdependent world? This question is at the center of the debate over the future role of the WTO (formerly GATT) in the realm of labor and environmental standards. In this paper we establish that the market access focus of current WTO rules is well equipped to handle the problems associated with choices over labor and environmental standards. In principle, with relatively modest changes that grant governments more sovereignty, not less, these rules can deliver globally efficient outcomes.</p>","Bagwell, Kyle Staiger, Robert W.",10.1162/00335530151144096,The Quarterly Journal of Economics,https://academic.oup.com/qje/article-pdf/116/2/519/5375210/116-2-519.pdf,2001/05/01,"Domestic Policies, National Sovereignty, and International Economic Institutions",https://academic.oup.com/qje/article/116/2/519/1904181/Domestic-Policies-National-Sovereignty-and,2001,280
733,"<p>We develop a baseline model of monetary and fiscal transmission in interdependent economies. The welfare effects of expansionary policies are related to monopolistic supply in production and monopoly power of a country in trade. An unanticipated exchange rate depreciation can be <em>beggar-thyself</em> rather than <em>beggar-thy-neighbor</em>, as gains in domestic output are offset by deteriorating terms of trade. Smaller and more open economies are more prone to suffer from inflationary shocks. Larger economies benefit from moderate demand-led expansions, but may be worse off if policy-makers attempt to close the output gap. Fiscal shocks are generally <em>beggar-thy-neighbor</em> in the long run; in the short run they raise domestic demand at given terms of trade, thus reducing the welfare benefits from monetary expansions. Analytical tractability makes our model uniquely suitable as a starting point to approach the recent “new open-economy macroeconomic” literature.</p>","Corsetti, Giancarlo Pesenti, Paolo",10.1162/00335530151144069,The Quarterly Journal of Economics,https://academic.oup.com/qje/article-pdf/116/2/421/5375167/116-2-421.pdf,2001/05/01,Welfare and Macroeconomic Interdependence,https://academic.oup.com/qje/article/116/2/421/1904165/Welfare-and-Macroeconomic-Interdependence,2001,281
734,"<p>We develop a model in which financial crises in emerging markets may occur when domestic banks are internationally illiquid. Runs on domestic deposits may interact with foreign creditor panics, depending on the maturity of the foreign debt and the possibility of international default. Financial liberalization and increased inflows of foreign capital, especially if short term, can aggravate the illiquidity of banks and increase their vulnerability. The primary role of illiquidity is consistent with the existence of asset price booms and crashes and of government distortions.</p>","Chang, Roberto Velasco, Andres",10.1162/00335530151144087,The Quarterly Journal of Economics,https://academic.oup.com/qje/article-pdf/116/2/489/5375204/116-2-489.pdf,2001/05/01,A Model of Financial Crises in Emerging Markets,https://academic.oup.com/qje/article/116/2/489/1904175/A-Model-of-Financial-Crises-in-Emerging-Markets,2001,282
735,"<p>This paper examines the often stated idea that the poor do not support high levels of redistribution because of the hope that they, or their offspring, may make it up the income ladder. This “prospect of upward mobility” (POUM) hypothesis is shown to be fully compatible with rational expectations, and fundamentally linked to concavity in the mobility process. A steady-state majority could even be simultaneously poorer than average in terms of current income, and richer than average in terms of expected future incomes. A first empirical assessment suggests, on the other hand, that in recent U. S. data the POUM effect is probably dominated by the demand for social insurance.</p>","Benabou, Roland Ok, Efe A.",10.1162/00335530151144078,The Quarterly Journal of Economics,https://academic.oup.com/qje/article-pdf/116/2/447/5375188/116-2-447.pdf,2001/05/01,Social Mobility and the Demand for Redistribution: The Poum Hypothesis,https://academic.oup.com/qje/article/116/2/447/1904170/Social-Mobility-and-the-Demand-for-Redistribution,2001,283
736,"<p>Many technologies used by the LDCs are developed in the OECD economies and are designed to make optimal use of the skills of these richer countries' workforces. Differences in the supply of skills create a mismatch between the requirements of these technologies and the skills of LDC workers, and lead to low productivity in the LDCs. Even when all countries have equal access to new technologies, this technology-skill mismatch can lead to sizable differences in total factor productivity and output per worker. We provide evidence in favor of the cross-industry productivity patterns predicted by our model, and also show that technology-skill mismatch could account for a large fraction of the observed output per worker differences in the data.</p>","Acemoglu, Daron Zilibotti, Fabrizio",10.1162/00335530151144104,The Quarterly Journal of Economics,https://academic.oup.com/qje/article-pdf/116/2/563/5375221/116-2-563.pdf,2001/05/01,Productivity Differences,https://academic.oup.com/qje/article/116/2/563/1904184/Productivity-Differences,2001,284
737,"<p>We show that if firms statistically discriminate among young workers on the basis of easily observable characteristics such as education, then as firms learn about productivity, the coefficients on the easily observed variables should fall, and the coefficients on hard-to-observe correlates of productivity should rise. We find support for this proposition using NLSY79 data on education, the AFQT test, father's education, and wages for young men and their siblings. We find little evidence for statistical discrimination in wages on the basis of race. Our analysis has a wide range of applications in the labor market and elsewhere.</p>","Altonji, Joseph G. Pierret, Charles R.",10.1162/003355301556329,The Quarterly Journal of Economics,https://academic.oup.com/qje/article-pdf/116/1/313/5462335/116-1-313.pdf,2001/02/01,Employer Learning and Statistical Discrimination,https://academic.oup.com/qje/article/116/1/313/1939055/Employer-Learning-and-Statistical-Discrimination,2001,285
738,"<p>Theoretical models predict that overconfident investors trade excessively. We test this prediction by partitioning investors on gender. Psychological research demonstrates that, in areas such as finance, men are more overconfident than women. Thus, theory predicts that men will trade more excessively than women. Using account data for over 35,000 households from a large discount brokerage, we analyze the common stock investments of men and women from February 1991 through January 1997. We document that men trade 45 percent more than women. Trading reduces men's net returns by 2.65 percentage points a year as opposed to 1.72 percentage points for women.</p>","Barber, Brad M. Odean, Terrance",10.1162/003355301556400,The Quarterly Journal of Economics,https://academic.oup.com/qje/article-pdf/116/1/261/5462232/116-1-261.pdf,2001/02/01,"Boys will be Boys: Gender, Overconfidence, and Common Stock Investment",https://academic.oup.com/qje/article/116/1/261/1939000/Boys-will-be-Boys-Gender-Overconfidence-and-Common,2001,286
739,"<p>We study gender differences in altruism by examining a modified dictator game with varying incomes and prices. Our results indicate that the question “which is the fair sex?” has a complicated answer—when altruism is expensive, women are kinder, but when it is cheap, men are more altruistic. That is, we find that the male and female “demand curves for altruism” cross, and that men are more responsive to price changes. Furthermore, men are more likely to be either perfectly selfish or perfectly selfless, whereas women tend to be “equalitarians” who prefer to share evenly.</p>","Andreoni, James Vesterlund, Lise",10.1162/003355301556419,The Quarterly Journal of Economics,https://academic.oup.com/qje/article-pdf/116/1/293/5462288/116-1-293.pdf,2001/02/01,Which is the Fair Sex? Gender Differences in Altruism,https://academic.oup.com/qje/article/116/1/293/1939030/Which-is-the-Fair-Sex-Gender-Differences-in,2001,287
740,"<p>This paper analyzes institutional investors' demand for stock characteristics and the implications of this demand for stock prices and returns. We find that “large” institutional investors nearly doubled their share of the stock market from 1980 to 1996. Overall, this compositional shift tends to increase demand for the stock of large companies and decrease demand for the stock of small companies. The compositional shift can, by itself, account for a nearly 50 percent increase in the price oflarge-company stock relative to small-company stock and can explain part of the disappearance of the historical small-company stock premium.</p>","Gompers, Paul A. Metrick, Andrew",10.1162/003355301556392,The Quarterly Journal of Economics,https://academic.oup.com/qje/article-pdf/116/1/229/5462155/116-1-229.pdf,2001/02/01,Institutional Investors and Equity Prices,https://academic.oup.com/qje/article/116/1/229/1938986/Institutional-Investors-and-Equity-Prices,2001,288
741,"<p>We offer evidence that legalized abortion has contributed significantly to recent crime reductions. Crime began to fall roughly eighteen years after abortion legalization. The five states that allowed abortion in 1970 experienced declines earlier than the rest of the nation, which legalized in 1973 with <em>Roe v. Wade</em>. States with high abortion rates in the 1970s and 1980s experienced greater crime reductions in the 1990s. In high abortion states, only arrests of those born after abortion legalization fall relative to low abortion states. Legalized abortion appears to account for as much as 50 percent of the recent drop in crime.</p>","Donohue, John J. Levitt, Steven D.",10.1162/00335530151144050,The Quarterly Journal of Economics,https://academic.oup.com/qje/article-pdf/116/2/379/5375154/116-2-379.pdf,2001/05/01,The Impact of Legalized Abortion on Crime,https://academic.oup.com/qje/article/116/2/379/1904158/The-Impact-of-Legalized-Abortion-on-Crime,2001,289
742,"<p>We think of <em>voice</em> as a means of information aggregation within groups operating in a variety of settings. We explore how the characteristics of groups and their leaders influence voice. In relatively homogeneous groups, members farthest away from the leader have the best incentives to provide information, and their voice tends to moderate policy decisions. In large heterogeneous groups where leaders cannot identifY individual members, the possibilities for informational exchange are severely limited, and any communication that exists pushes policies farther to the extreme.</p>","Banerjee, Abhijit Somanathan, Rohini",10.1162/003355301556383,The Quarterly Journal of Economics,https://academic.oup.com/qje/article-pdf/116/1/189/5462096/116-1-189.pdf,2001/02/01,A Simple Model of Voice,https://academic.oup.com/qje/article/116/1/189/1938961/A-Simple-Model-of-Voice,2001,290
743,"<p>Recent models of procrastination due to self-control problems assume that a procrastinator considers just one option and is unaware of her self-control problems. We develop a model where a person chooses from a menu of options and is partially aware of her self-control problems. This menu model replicates earlier results and generates new ones. A person might forgo completing an attractive option because she plans to complete a more attractive but never-to-be-completed option. Hence, providing a nonprocrastinator additional options can induce procrastination, and a person may procrastinate worse pursuing important goals than unimportant ones.</p>","O'Donoghue, Ted Rabin, Matthew",10.1162/003355301556365,The Quarterly Journal of Economics,https://academic.oup.com/qje/article-pdf/116/1/121/5461993/116-1-121.pdf,2001/02/01,Choice and Procrastination,https://academic.oup.com/qje/article/116/1/121/1938917/Choice-and-Procrastination,2001,291
744,"<p>This project tests for the effect of social status in a laboratory experimental market. We consider a special “box design” market in which a vertical overlap in supply and demand ensure that there are multiple equilibrium prices. We manipulate the relative social status of our subjects by awarding high status to a subset of the group based on one of two procedures. In the first, a subject's score on a trivia quiz determines his or her status; in another, subjects are assigned randomly to a higher-status or lower-status group. In both treatments we find that average prices are higher in markets where higher-status sellers face lowerstatus buyers, and lower when buyers have higher status than sellers. Across all sessions, the higher-status side of the market captures a greater share of the surplus, earning significantly more than their lower-status counterparts.</p>","Ball, Sheryl Eckel, Catherine Grossman, Philip J. Zame, William",10.1162/003355301556374,The Quarterly Journal of Economics,https://academic.oup.com/qje/article-pdf/116/1/161/5462047/116-1-161.pdf,2001/02/01,Status in Markets,https://academic.oup.com/qje/article/116/1/161/1938945/Status-in-Markets,2001,292
745,"<p>Psychological experiments demonstrate that repeated pairings of a cue and a consumption good eventually create cue-based complementarities: the presence of the cue raises the marginal utility derived from consumption. In this paper, such dynamic preferences are embedded in a rational choice model. Behavior that arises from this model is characterized by endogenous cue sensitivities, costly cue-management, commitment, and cue-based spikes in impatience. The model is used to understand addictive/habit-forming behaviors and marketing. The model explains why preferences change rapidly from moment to moment, why temptations should sometimes be avoided, and how firms package and position goods.</p>","Laibson, David",10.1162/003355301556356,The Quarterly Journal of Economics,https://academic.oup.com/qje/article-pdf/116/1/81/5462471/116-1-81.pdf,2001/02/01,A Cue-Theory of Consumption,https://academic.oup.com/qje/article/116/1/81/1939108/A-Cue-Theory-of-Consumption,2001,293
746,<p>We extend expected utility theory to situations in which agents experience feelings of anticipation prior to the resolution of uncertainty. We show how these anticipatory feelings may result in time inconsistency. We provide an example from portfolio theory to illustrate the potential impact of anticipation on asset prices.</p>,"Caplin, Andrew Leahy, John",10.1162/003355301556347,The Quarterly Journal of Economics,https://academic.oup.com/qje/article-pdf/116/1/55/5462436/116-1-55.pdf,2001/02/01,Psychological Expected Utility Theory and Anticipatory Feelings,https://academic.oup.com/qje/article/116/1/55/1939090/Psychological-Expected-Utility-Theory-and,2001,294
747,"<p>We study asset prices in an economy where investors derive direct utility not only from consumption but also from fluctuations in the value of their financial wealth. They are loss averse over these fluctuations, and the degree of loss aversion depends on their prior investment performance. We find that our framework can help explain the high mean, excess volatility, and predictability of stock returns, as well as their low correlation with consumption growth. The design of our model is influenced by prospect theory and by experimental evidence on how prior outcomes affect risky choice.</p>","Barberis, Nicholas Huang, Ming Santos, Tano",10.1162/003355301556310,The Quarterly Journal of Economics,https://academic.oup.com/qje/article-pdf/116/1/1/5461932/116-1-1.pdf,2001/02/01,Prospect Theory and Asset Prices,https://academic.oup.com/qje/article/116/1/1/1938887/Prospect-Theory-and-Asset-Prices,2001,295
748,"<p>During 1984–1996, welfare and tax policy were changed to encourage work by single mothers. The Earned Income Tax Credit was expanded, welfare benefits were cut, welfare time limits were added, and welfare cases were terminated. Medicaid for the working poor was expanded, as were training programs and child care. During this same time period there were unprecedented increases in the employment and hours of single mothers. We show that a large share of the increase in work by single mothers can be attributed to the EITC and other tax changes, with smaller shares for welfare benefit cuts, welfare waivers, training programs and child care programs.</p>","Meyer, Bruce D. Rosenbaum, Dan T.",10.1162/00335530152466313,The Quarterly Journal of Economics,https://academic.oup.com/qje/article-pdf/116/3/1063/5364595/116-3-1063.pdf,2001/08/01,"Welfare, the Earned Income Tax Credit, and the Labor Supply of Single Mothers",https://academic.oup.com/qje/article/116/3/1063/1899757/Welfare-the-Earned-Income-Tax-Credit-and-the-Labor,2001,296
749,"<p>Does competition among financial intermediaries lead to excessively low standards? To examine this question, we construct a model where intermediaries design contracts to attract trading volume, taking into consideration that traders differ in credit quality and may default. When credit quality is observable, intermediaries demand the “right” amount of guarantees. A monopolist would demand fewer guarantees. Private information about credit quality has an ambiguous effect in a competitive environment. When the cost of default is large (small), private information leads to higher (lower) standards. We exhibit examples where private information is present and competition produces higher standards than monopoly does.</p>","Santos, Tano Scheinkman, Jose A.",10.1162/00335530152466304,The Quarterly Journal of Economics,https://academic.oup.com/qje/article-pdf/116/3/1027/5364587/116-3-1027.pdf,2001/08/01,Competition among Exchanges,https://academic.oup.com/qje/article/116/3/1027/1899754/Competition-among-Exchanges,2001,297
