,abstract,author,doi,journal,pdf_url,publication_date,title,url,year,index
2,"<p>Empirically, disincentive effects on work of generous welfare state arrangements tend to appear with a substantial time lag. One explanation is that norms concerning work and benefit dependency delay such effects. We model altruistic parents' economic incentives for instilling such work norms in their children. Anticipated economic support from parents may reduce work effort, and parental altruism makes threats to withdraw such support noncredible. Instilling norms mitigates this problem. However, generous social insurance arrangements tend to weaken parents' incentives to instill such norms in their children. We find empirical support for this prediction.</p>","Lindbeck, Assar Nyberg, Sten",10.1093/qje/121.4.1473,The Quarterly Journal of Economics,https://academic.oup.com/qje/article-pdf/121/4/1473/5248568/121-4-1473.pdf,2006/11/01,"Raising Children to Work Hard: Altruism, Work Norms, and Social Insurance",https://academic.oup.com/qje/article/121/4/1473/1855239/Raising-Children-to-Work-Hard-Altruism-Work-Norms,2006,0
3,"<p>A continuum of ages exists at school entry due to the use of a single school cutoff date—making the “oldest” children approximately 20 percent older than the “youngest” children. We provide substantial evidence that these initial maturity differences have long-lasting effects on student performance across OECD countries. In particular, the youngest members of each cohort score 4–12 percentiles lower than the oldest members in grade four and 2–9 percentiles lower in grade eight. In fact, data from Canada and the United States show that the youngest members of each cohort are even less likely to attend university.</p>","Bedard, Kelly Dhuey, Elizabeth",10.1093/qje/121.4.1437,The Quarterly Journal of Economics,https://academic.oup.com/qje/article-pdf/121/4/1437/5248560/121-4-1437.pdf,2006/11/01,The Persistence of Early Childhood Maturity: International Evidence of Long-Run Age Effects,https://academic.oup.com/qje/article/121/4/1437/1855234/The-Persistence-of-Early-Childhood-Maturity,2006,1
5,"<p>A club's majority rule defines the number of members that must approve a policy proposed to replace the status quo. Since the majority rule thus dictates the extent to which winners must compensate losers, it also determines the incentives to invest in order to become a winner of anticipated projects. If the required majority is large, members invest too little because of a holdup problem; if it is small, members invest too much in order to become a member of the majority coalition. To balance these opposing forces, the majority rule should increase in the project's value and the club's enforcement capacity but decrease in the heterogeneity in preferences. Externalities can be internalized by adjusting the rule. With heterogeneity in size or initial conditions, votes should be appropriately weighted or double majorities required.</p>","Harstad, Bård",10.1162/003355305775097551,The Quarterly Journal of Economics,https://academic.oup.com/qje/article-pdf/120/4/1535/5431362/120-4-1535.pdf,2005/11/01,Majority Rules and Incentives,https://academic.oup.com/qje/article/120/4/1535/1926697/Majority-Rules-and-Incentives,2005,2
6,"<p>We build a model of competitive pooling, which incorporates adverse selection and signaling into general equilibrium. Pools are characterized by their quantity limits on contributions. Households signal their reliability by choosing which pool to join. In equilibrium, pools with lower quantity limits sell for a higher price, even though each household's deliveries are the same at all pools. The Rothschild-Stiglitz model of insurance is included as a special case. We show that by recasting their hybrid oligopolistic-competitive story in our perfectly competitive framework, their separating equilibrium always exists (even when they say it does not) and is unique.</p>","Dubey, Pradeep Geanakoplos, John",10.1162/003355302320935098,The Quarterly Journal of Economics,https://academic.oup.com/qje/article-pdf/117/4/1529/5304511/117-4-1529.pdf,2002/11/01,Competitive Pooling: Rothschild-Stiglitz Reconsidered,https://academic.oup.com/qje/article/117/4/1529/1876032/Competitive-Pooling-Rothschild-Stiglitz,2002,3
7,"<p>We investigate how integration of bank ownership across states has affected economic volatihty within states. In theory, bank integration could cause higher or lower volatility, depending on whether credit supply or credit demand shocks predominate. In fact, year-to-year fluctuations in a state's economic growth fall as its banks become more integrated (via holding companies) with banks in other states. As the bank linkages between any pair of states increase, fluctuations in those two states tend to converge. We conclude that interstate banking has made state business cycles smaller, but more alike.</p>","Morgan, Donald P. Rime, Bertrand Strahan, Philip E.",10.1162/0033553042476161,The Quarterly Journal of Economics,https://academic.oup.com/qje/article-pdf/119/4/1555/5236141/119-4-1555.pdf,2004/11/01,Bank Integration and State Business Cycles,https://academic.oup.com/qje/article/119/4/1555/1851081/Bank-Integration-and-State-Business-Cycles,2004,4
8,"<p>Estimates of the effect of college selectivity on earnings may be biased because elite colleges admit students, in part, based on characteristics that are related to future earnings. We matched students who applied to, and were accepted by, similar colleges to try to eliminate this bias. Using the College and Beyond data set and National Longitudinal Survey of the High School Class of 1972, we find that students who attended more selective colleges earned about the same as students of seemingly comparable ability who attended less selective schools. Children from low-income families, however, earned more if they attended selective colleges.</p>","Dale, Stacy Berg Krueger, Alan B.",10.1162/003355302320935089,The Quarterly Journal of Economics,https://academic.oup.com/qje/article-pdf/117/4/1491/5304491/117-4-1491.pdf,2002/11/01,Estimating the Payoff to Attending a More Selective College: An Application of Selection on Observables and Unobservables,https://academic.oup.com/qje/article/117/4/1491/1876022/Estimating-the-Payoff-to-Attending-a-More,2002,5
10,"<p>Research on information economics and securities markets dating back to Stigler (<em>Journal of Political Economy</em>, 69 (1961), 213–225; <em>Journal of Business</em>, 37 (1964), 117–142) argues that trading will tend to centralize in major market centers such as the New York Stock Exchange (NYSE). The NYSE's recent mergers with Archipelago and Euronext bring questions about the viability and effects of competition between stock exchanges to the policy forefront. We examine the largely forgotten but unparalleled episode of competition between the NYSE and the Consolidated Stock Exchange of New York (Consolidated) from 1885 to 1926. The Consolidated averaged 23% of NYSE volume for approximately forty years by operating a second market for the most liquid securities that traded on the Big Board. Our results suggest that NYSE bid-ask spreads fell by more than 10% when the Consolidated began to trade NYSE stocks and subsequently increased when the Consolidated ceased operations. The empirical analysis suggests that this historical episode of stock market competition improved consumer welfare by an amount equivalent to US$9.6 billion today.</p>","Brown, William O. Mulherin, J. Harold Weidenmier, Marc D.",10.1162/qjec.2008.123.4.1679,The Quarterly Journal of Economics,https://academic.oup.com/qje/article-pdf/123/4/1679/5446935/123-4-1679.pdf,2008/11/01,Competing with the New York Stock Exchange,https://academic.oup.com/qje/article/123/4/1679/1933219/Competing-with-the-New-York-Stock-Exchange,2008,6
11,"<p>We test whether textbook consumers are forward-looking, using a large new data set on textbooks sold in college bookstores during the ten semesters from 1997 to 2001. The data strongly support the hypothesis that students are forward-looking with low short-run discount rates and that they behave as if they have rational expectations of publishers' revision behavior. Data from a second new data set on the market prices of used books at Amazon Marketplace also support the hypothesis of rational, forward-looking behavior. Simulation results indicate that students are sufficiently forward-looking that publishers cannot consistently raise revenue by accelerating current revision cycles.</p>","Chevalier, Judith Goolsbee, Austan",10.1162/qjec.2009.124.4.1853,The Quarterly Journal of Economics,https://academic.oup.com/qje/article-pdf/124/4/1853/5407395/124-4-1853.pdf,2009/11/01,Are Durable Goods Consumers Forward-Looking? Evidence from College Textbooks,https://academic.oup.com/qje/article/124/4/1853/1917235/Are-Durable-Goods-Consumers-Forward-Looking,2009,7
56,"<p>We conducted online field experiments in large real-world social networks in order to decompose prosocial giving into three components: (1) <em>baseline altruism</em> toward randomly selected strangers, (2) <em>directed altruism</em> that favors friends over random strangers, and (3) giving motivated by the <em>prospect of future interaction</em>. Directed altruism increases giving to friends by 52% relative to random strangers, whereas future interaction effects increase giving by an additional 24% when giving is socially efficient. This finding suggests that future interaction affects giving through a repeated game mechanism where agents can be rewarded for granting efficiency-enhancing favors. We also find that subjects with higher baseline altruism have friends with higher baseline altruism.</p>","Leider, Stephen Möbius, Markus M. Rosenblat, Tanya Do, Quoc-Anh",10.1162/qjec.2009.124.4.1815,The Quarterly Journal of Economics,https://academic.oup.com/qje/article-pdf/124/4/1815/5407387/124-4-1815.pdf,2009/11/01,Directed Altruism and Enforced Reciprocity in Social Networks,https://academic.oup.com/qje/article/124/4/1815/1917230/Directed-Altruism-and-Enforced-Reciprocity-in,2009,8
57,"<p>The folk theorem of repeated games has established that cooperative behavior can be sustained as an equilibrium in repeated settings. Early papers on private monitoring and a recent paper of Cole and Kocherlakota (<em>Games and Economic Behavior</em>, 53 [2005], 59–72) challenge the robustness of this result by providing examples in which cooperation breaks down when players observe only imperfect private signals about other players' actions, or when attention is restricted to strategies with finite memory. This paper shows that Cole and Kocherlakota's result is an artefact of a further restriction that they impose. We prove that the folk theorem with imperfect public monitoring holds with strategies with finite memory. As a corollary, we establish that the folk theorem extends to environments in which monitoring is close to public, yet private.</p>","Hörner, Johannes Olszewski, Wojciech",10.1162/qjec.2009.124.4.1773,The Quarterly Journal of Economics,https://academic.oup.com/qje/article-pdf/124/4/1773/5407371/124-4-1773.pdf,2009/11/01,How Robust is the Folk Theorem?,https://academic.oup.com/qje/article/124/4/1773/1917223/How-Robust-is-the-Folk-Theorem,2009,9
58,"<p>Most major American industrial business cycles from around 1880 to the First World War were caused by fluctuations in the size of the cotton harvest due to economically exogenous factors such as weather. Wheat and corn harvests did not affect industrial production; nor did the cotton harvest before the late 1870s. The unique effect of the cotton harvest in this period can be explained as an essentially monetary phenomenon, the result of interactions between harvests, international gold flows, and high-powered money demand under America's goldstandard regime of 1879–1914.</p>","Davis, Joseph H. Hanes, Christopher Rhode, Paul W.",10.1162/qjec.2009.124.4.1675,The Quarterly Journal of Economics,https://academic.oup.com/qje/article-pdf/124/4/1675/5407327/124-4-1675.pdf,2009/11/01,Harvests and Business Cycles in Nineteenth-Century America,https://academic.oup.com/qje/article/124/4/1675/1917206/Harvests-and-Business-Cycles-in-Nineteenth-Century,2009,10
59,"<p>We use prenatal exposure to Chernobyl fallout in Sweden as a natural experiment inducing variation in cognitive ability. Students born in regions of Sweden with higher fallout performed worse in secondary school, in mathematics in particular. Damage is accentuated within families (i.e., siblings comparison) and among children born to parents with low education. In contrast, we detect no corresponding damage to health outcomes. To the extent that parents responded to the cognitive endowment, we infer that parental investments reinforced the initial Chernobyl damage. From a public health perspective, our findings suggest that cognitive ability is compromised at radiation doses currently considered harmless.</p>","Almond, Douglas Edlund, Lena Palme, Mårten",10.1162/qjec.2009.124.4.1729,The Quarterly Journal of Economics,https://academic.oup.com/qje/article-pdf/124/4/1729/5407354/124-4-1729.pdf,2009/11/01,Chernobyl's Subclinical Legacy: Prenatal Exposure to Radioactive Fallout and School Outcomes in Sweden,https://academic.oup.com/qje/article/124/4/1729/1917216/Chernobyl-s-Subclinical-Legacy-Prenatal-Exposure,2009,11
60,"<p>Defaults often have a large influence on consumer decisions. We identify an overlooked but practical alternative to defaults: requiring individuals to make explicit choices for themselves. We study such “active decisions” in the context of 401(k) saving. We find that compelling new hires to make active decisions about 401(k) enrollment raises the initial fraction that enroll by 28 percentage points relative to a standard opt-in enrollment procedure, producing a savings distribution three months after hire that would take thirty months to achieve under standard enrollment. We also present a model of 401(k) enrollment and derive conditions under which the optimal enrollment regime is automatic enrollment (i.e., default enrollment), standard enrollment (i.e., default nonenrollment), or active decisions (i.e., no default and compulsory choice). Active decisions are optimal when consumers have a strong propensity to procrastinate and savings preferences are highly heterogeneous. Financial illiteracy, however, favors default enrollment over active decision enrollment.</p>","Carroll, Gabriel D. Choi, James J. Laibson, David Madrian, Brigitte C. Metrick, Andrew",10.1162/qjec.2009.124.4.1639,The Quarterly Journal of Economics,https://academic.oup.com/qje/article-pdf/124/4/1639/5407319/124-4-1639.pdf,2009/11/01,Optimal Defaults and Active Decisions,https://academic.oup.com/qje/article/124/4/1639/1917201/Optimal-Defaults-and-Active-Decisions,2009,12
61,"<p>Compensation, status, and press coverage of managers in the United States follow a highly skewed distribution: a small number of “superstars” enjoy the bulk of the rewards. We evaluate the impact of CEOs achieving superstar status on the performance of their firms, using prestigious business awards to measure shocks to CEO status. We find that award-winning CEOs subsequently underperform, both relative to their prior performance and relative to a matched sample of non-winning CEOs. At the same time, they extract more compensation following the awards, both in absolute amounts and relative to other top executives in their firms. They also spend more time on public and private activities outside their companies, such as assuming board seats or writing books. The incidence of earnings management increases after winning awards. The effects are strongest in firms with weak corporate governance. Our results suggest that the <em>ex post</em> consequences of media-induced superstar status for shareholders are negative.</p>","Malmendier, Ulrike Tate, Geoffrey",10.1162/qjec.2009.124.4.1593,The Quarterly Journal of Economics,https://academic.oup.com/qje/article-pdf/124/4/1593/5407308/124-4-1593.pdf,2009/11/01,Superstar CEOs,https://academic.oup.com/qje/article/124/4/1593/1917196/Superstar-CEOs,2009,13
62,"<p>The nineteenth century witnessed dramatic improvements in the legal rights of married women. Given that they took place long before women gained the right to vote, these changes amounted to a voluntary renunciation of power by men. In this paper, we investigate men's incentives for sharing power with women. In our model, women's legal rights set the marital bargaining power of husbands and wives. We show that men face a trade-off between the rights they want for their own wives (namely none) and the rights of other women in the economy. Men prefer other men's wives to have rights because men care about their own daughters and because an expansion of women's rights increases educational investments in children. We show that men may agree to relinquish some of their power once technological change increases the importance of human capital. We corroborate our argument with historical evidence on the expansion of women's rights in England and the United States.</p>","Doepke, Matthias Tertilt, Michèle",10.1162/qjec.2009.124.4.1541,The Quarterly Journal of Economics,https://academic.oup.com/qje/article-pdf/124/4/1541/5407296/124-4-1541.pdf,2009/11/01,Women's Liberation: What's in It for Men?,https://academic.oup.com/qje/article/124/4/1541/1917192/Women-s-Liberation-What-s-in-It-for-Men,2009,14
63,"<p>We exploit random assignment of gender quotas for leadership positions on Indian village councils to show that prior exposure to a female leader is associated with electoral gains for women. After ten years of quotas, women are more likely to stand for, and win, elected positions in councils required to have a female chief councilor in the previous two elections. We provide experimental and survey evidence on one channel of influence—changes in voter attitudes. Prior exposure to a female chief councilor improves perceptions of female leader effectiveness and weakens stereotypes about gender roles in the public and domestic spheres.</p>","Beaman, Lori Chattopadhyay, Raghabendra Duflo, Esther Pande, Rohini Topalova, Petia",10.1162/qjec.2009.124.4.1497,The Quarterly Journal of Economics,https://academic.oup.com/qje/article-pdf/124/4/1497/5407286/124-4-1497.pdf,2009/11/01,Powerful Women: Does Exposure Reduce Bias?,https://academic.oup.com/qje/article/124/4/1497/1917190/Powerful-Women-Does-Exposure-Reduce-Bias,2009,15
64,"<p>Resource misallocation can lower aggregate total factor productivity (TFP). We use microdata on manufacturing establishments to quantify the potential extent of misallocation in China and India versus the United States. We measure sizable gaps in marginal products of labor and capital across plants within narrowly defined industries in China and India compared with the United States. When capital and labor are hypothetically reallocated to equalize marginal products to the extent observed in the United States, we calculate manufacturing TFP gains of 30%–50% in China and 40%–60%.in India.</p>","Hsieh, Chang-Tai Klenow, Peter J.",10.1162/qjec.2009.124.4.1403,The Quarterly Journal of Economics,https://academic.oup.com/qje/article-pdf/124/4/1403/5407260/124-4-1403.pdf,2009/11/01,Misallocation and Manufacturing TFP in China and India,https://academic.oup.com/qje/article/124/4/1403/1917179/Misallocation-and-Manufacturing-TFP-in-China-and,2009,16
65,"<p>We conduct a within-county analysis using detailed ZIP code—level data to document new findings regarding the origins of the biggest financial crisis since the Great Depression. The sharp increase in mortgage defaults in 2007 is significantly amplified in subprime ZIP codes, or ZIP codes with a disproportionately large share of subprime borrowers as of 1996. Prior to the default crisis, these subprime ZIP codes experience an unprecedented relative growth in mortgage credit. The expansion in mortgage credit from 2002 to 2005 to subprime ZIP codes occurs despite sharply declining relative (and in some cases absolute) income growth in these neighborhoods. In fact, 2002 to 2005 is the only period in the past eighteen years in which income and mortgage credit growth are negatively correlated. We show that the expansion in mortgage credit to subprime ZIP codes and its dissociation from income growth is closely correlated with the increase in securitization of subprime mortgages.</p>","Mian, Atif Sufi, Amir",10.1162/qjec.2009.124.4.1449,The Quarterly Journal of Economics,https://academic.oup.com/qje/article-pdf/124/4/1449/5407278/124-4-1449.pdf,2009/11/01,The Consequences of Mortgage Credit Expansion: Evidence from the U.S. Mortgage Default Crisis,https://academic.oup.com/qje/article/124/4/1449/1917185/The-Consequences-of-Mortgage-Credit-Expansion,2009,17
66,"<p>How do liquidation values affect financial contract renegotiation? While the “incomplete-contracting” theory of financial contracting predicts that liquidation values determine the allocation of bargaining power between creditors and debtors, there is little empirical evidence on financial contract renegotiations and the role asset values play in such bargaining. This paper attempts to fill this gap. We develop an incomplete-contracting model of financial contract renegotiation and estimate it using data on the airline industry in the United States. We find that airlines successfully renegotiate their lease obligations downward when their financial position is sufficiently poor and when the liquidation value of their fieet is low. Our results show that strategic renegotiation is common in the airline industry. Moreover, the results emphasize the importance of the incomplete contracting perspective to real-world financial contract renegotiation.</p>","Benmelech, Efraim Bergman, Nittai K.",10.1162/qjec.2008.123.4.1635,The Quarterly Journal of Economics,https://academic.oup.com/qje/article-pdf/123/4/1635/5446925/123-4-1635.pdf,2008/11/01,Liquidation Values and the Credibility of Financial Contract Renegotiation: Evidence from U.S. Airlines,https://academic.oup.com/qje/article/123/4/1635/1933211/Liquidation-Values-and-the-Credibility-of,2008,18
67,"<p>We examine how incumbents respond to the <em>threat</em> of entry by competitors (as distinct from how they respond to <em>actual</em> entry). We look specifically at passenger airlines, using the evolution of Southwest Airlines' route network to identify particular routes where the probability of future entry rises abruptly. We find that incumbents cut fares significantly when threatened by Southwest's entry. Over half of Southwest's total impact on incumbent fares occurs before Southwest starts flying. These cuts are only on threatened routes, not those out of non-Southwest competing airports. The evidence on whether incumbents are seeking to deter or accommodate entry is mixed.</p>","Goolsbee, Austan Syverson, Chad",10.1162/qjec.2008.123.4.1611,The Quarterly Journal of Economics,https://academic.oup.com/qje/article-pdf/123/4/1611/5446913/123-4-1611.pdf,2008/11/01,How Do Incumbents Respond to the Threat of Entry? Evidence from the Major Airlines,https://academic.oup.com/qje/article/123/4/1611/1933206/How-Do-Incumbents-Respond-to-the-Threat-of-Entry,2008,19
68,"<p>This paper uses a natural experiment to test the impact of counterfeiting under weak intellectual property rights. I collect new panel data from Chinese shoe companies from 1993–2004. By exploiting the discontinuity of government enforcement efforts for the footwear sector in 1995 and the differences in authentic companies' relationships with the government, I identify and measure the effects of counterfeit entry on authentic prices, qualities, and other market outcomes. The results show that brands with less government protection differentiate their products through innovation, self-enforcement, vertical integration of downstream retailers, and subtle high-price signals. These strategies push up authentic prices and are effective in reducing counterfeit sales.</p>","Qian, Yi",10.1162/qjec.2008.123.4.1577,The Quarterly Journal of Economics,https://academic.oup.com/qje/article-pdf/123/4/1577/11104646/123-4-1577.pdf,2008/11/01,Impacts of Entry by Counterfeiters,https://academic.oup.com/qje/article/123/4/1577/1933192/Impacts-of-Entry-by-Counterfeiters,2008,20
69,"<p>We examine the effect of regionalism on unilateral trade liberalization using industry-level data on applied most-favored nation (MFN) tariffs and bilateral preferences for ten Latin American countries from 1990 to 2001. We find that preferential tariff reduction in a given sector leads to a reduction in the external (MFN) tariff in that sector. External liberalization is greater if preferences are granted to important suppliers. However, these “complementarity effects” of preferential liberalization on external liberalization do not arise in customs unions. Overall, our results suggest that concerns about a negative effect of preferential liberalization on external trade liberalization are unfounded.</p>","Estevadeordal, Antoni Freund, Caroline Ornelas, Emanuel",10.1162/qjec.2008.123.4.1531,The Quarterly Journal of Economics,https://academic.oup.com/qje/article-pdf/123/4/1531/5446881/123-4-1531.pdf,2008/11/01,Does Regionalism Affect Trade Liberalization Toward Nonmembers?,https://academic.oup.com/qje/article/123/4/1531/1933189/Does-Regionalism-Affect-Trade-Liberalization,2008,21
