,abstract,author,doi,journal,pdf_url,publication_date,title,url,year,index
150,"<p>The majority of U. S. temporary help supply (THS) firms offer nominally free, unrestricted computer skills training, a practice inconsistent with the competitive model of training. I propose and test a model in which firms offer general training to induce self-selection and perform screening of worker ability. The model implies, and the data confirm, that firms providing training attract higher ability workers yet pay them lower wages <em>after</em> training. Thus, beyond providing spot market labor, THS firms sell information about worker quality to their clients. The rapid growth of THS employment suggests that demand for worker screening is rising.</p>","Autor, David H.",10.1162/003355301753265615,The Quarterly Journal of Economics,https://academic.oup.com/qje/article-pdf/116/4/1409/5372870/116-4-1409.pdf,2001/11/01,Why Do Temporary Help Firms Provide Free General Skills Training?,https://academic.oup.com/qje/article/116/4/1409/1903245/Why-Do-Temporary-Help-Firms-Provide-Free-General,2001,84
151,"<p>Immigration increased Israel's population by 12 percent between 1990 and 1994, after emigration restrictions were lifted in an unstable Soviet Union. Following the influx, occupations that employed more immigrants had substantially lower native wage growth and slightly lower native employment growth than others. However, because the immigrants' postmigration occupational distribution was influenced by relative labor market conditions across occupations in Israel, Ordinary Least Squares estimates of the immigrants' impact on those conditions are biased. Instrumental Variables estimation, exploiting information on the immigrants' former occupations abroad, suggests no adverse impact of immigration on native outcomes.</p>","Friedberg, Rachel M.",10.1162/003355301753265606,The Quarterly Journal of Economics,https://academic.oup.com/qje/article-pdf/116/4/1373/5372863/116-4-1373.pdf,2001/11/01,The Impact of Mass Migration on the Israeli Labor Market,https://academic.oup.com/qje/article/116/4/1373/1903234/The-Impact-of-Mass-Migration-on-the-Israeli-Labor,2001,85
153,"<p>There has been a dramatic change in the division of responsibility between the state and the private sector for the delivery of public goods and services in recent years with an increasing trend toward contracting out to the private sector and “public-private partnerships.” This paper analyzes how ownership matters in public good provision. We show that if contracts are incomplete then the ownership of a public good should lie with a party that values the benefits generated by it relatively more. This is true regardless of whether this party is also the key investor, or other aspects of the technology.</p>","Besley, Timothy Ghatak, Maitreesh",10.1162/003355301753265598,The Quarterly Journal of Economics,https://academic.oup.com/qje/article-pdf/116/4/1343/5372847/116-4-1343.pdf,2001/11/01,Government Versus Private Ownership of Public Goods,https://academic.oup.com/qje/article/116/4/1343/1903229/Government-Versus-Private-Ownership-of-Public,2001,86
155,"<p>Many social commentators have raised concerns over the possibility that increased sorting in society may lead to greater inequality. To investigate this, we construct a dynamic model of intergenerational education acquisition, fertility, and marital sorting and parameterize the steady state to match several basic empirical findings. We find that increased sorting will significantly increase income inequality. Four factors are important to our findings: a negative correlation between fertility and education, a decreasing marginal effect of parental education on children's years of education, wages that are sensitive to the relative supply of skilled workers, and borrowing constraints that affect educational attainment for some low-income households.</p>","Fernández, Raquel Rogerson, Richard",10.1162/003355301753265589,The Quarterly Journal of Economics,https://academic.oup.com/qje/article-pdf/116/4/1305/5372834/116-4-1305.pdf,2001/11/01,Sorting and Long-Run Inequality,https://academic.oup.com/qje/article/116/4/1305/1903222/Sorting-and-Long-Run-Inequality,2001,87
156,"<p>School finance equalization has probably affected American schools more than any other reform of the last 30 years. Understanding it is a prerequisite for making optimal social investments in human capital. Yet, it is poorly understood. In this paper I explain why: it differs from conventional redistribution because it is based on property values, which are <em>endogenous</em> to schools' productivity, taste for education, and the school finance system itself. I characterize equalization schemes and show why some “level down” and others “level up.” Schemes that strongly level down have unintended consequences: even poor districts can end up worse off. I also show how school finance equalization affects property prices, private school attendance, and student achievement.</p>","Hoxby, Caroline M.",10.1162/003355301753265552,The Quarterly Journal of Economics,https://academic.oup.com/qje/article-pdf/116/4/1189/5372776/116-4-1189.pdf,2001/11/01,All School Finance Equalizations are Not Created Equal,https://academic.oup.com/qje/article/116/4/1189/1903168/All-School-Finance-Equalizations-are-Not-Created,2001,88
157,"<p>This paper makes two contributions to the modeling of addiction. First, we provide new and convincing evidence that smokers are forward-looking in their smoking decisions, using state excise tax increases that have been legislatively enacted but are not yet effective, and monthly data on consumption. Second, we recognize the strong evidence that preferences with respect to smoking are time inconsistent, with individuals both not recognizing the true difficulty of quitting and searching for self-control devices to help them quit. We develop a new model of addictive behavior that takes as its starting point the standard “rational addiction” model, but incorporates time-inconsistent preferences. This model also exhibits forward-looking behavior, but it has strikingly different normative implications; in this case optimal government policy should depend not only on the externalities that smokers impose on others but also on the “internalities” imposed by smokers on themselves. We estimate that the optimal tax per pack of cigarettes should he at least one dollar higher under our formulation than in the rational addiction case.</p>","Gruber, Jonathan Köszegi, Botond",10.1162/003355301753265570,The Quarterly Journal of Economics,https://academic.oup.com/qje/article-pdf/116/4/1261/5372816/116-4-1261.pdf,2001/11/01,Is Addiction “Rational”? Theory and Evidence,https://academic.oup.com/qje/article/116/4/1261/1903215/Is-Addiction-Rational-Theory-and-Evidence,2001,89
158,"<p>This paper analyzes the impact of automatic enrollment on 401(k) savings behavior. We have two key findings. First, 401(k) participation is significantly higher under automatic enrollment. Second, a substantial fraction of 401(k) participants hired under automatic enrollment retain both the default contribution rate and fund allocation even though few employees hired before automatic enrollment picked this particular outcome. This “default” behavior appears to result from participant inertia and from employee perceptions of the default as investment advice. These findings have implications for the design of 401(k) savings plans as well as for any type of Social Security reform that includes personal accounts over which individuals have control. They also shed light more generally on the importance of both economic and noneconomic (behavioral) factors in the determination of individual savings behavior.</p>","Madrian, Brigitte C. Shea, Dennis F.",10.1162/003355301753265543,The Quarterly Journal of Economics,https://academic.oup.com/qje/article-pdf/116/4/1149/5372689/116-4-1149.pdf,2001/11/01,The Power of Suggestion: Inertia in 401(k) Participation and Savings Behavior,https://academic.oup.com/qje/article/116/4/1149/1903159/The-Power-of-Suggestion-Inertia-in-401-k,2001,90
159,"<p>Data from downtown Boston in the 1990s show that loss aversion determines seller behavior in the housing market. Condominium owners subject to nominal losses 1) set higher asking prices of 25–35 percent of the difference between the property's expected selling price and their original purchase price; 2) attain higher selling prices of 3–18 percent of that difference; and 3) exhibit a much lower sale hazard than other sellers. The list price results are twice as large for owneroccupants as investors, but hold for both. These findings suggest that sellers are averse to realizing (nominal) losses and help explain the positive price-volume correlation in real estate markets.</p>","Genesove, David Mayer, Christopher",10.1162/003355301753265561,The Quarterly Journal of Economics,https://academic.oup.com/qje/article-pdf/116/4/1233/5372802/116-4-1233.pdf,2001/11/01,Loss Aversion and Seller Behavior: Evidence from the Housing Market,https://academic.oup.com/qje/article/116/4/1233/1903212/Loss-Aversion-and-Seller-Behavior-Evidence-from,2001,91
249,"<p>This paper analyzes the effects of changes in the duration of paid, job-protected parental leave on mothers' higher-order fertility and postbirth labor market careers. Identification is based on a major Austrian reform increasing the duration of parental leave from one year to two years for any child born on or after July 1, 1990. We find that mothers who give birth to their first child immediately after the reform have more second children than prereform mothers, and that extended parental leave significantly reduces return to work. Employment and earnings also decrease in the short run, but not in the long run. Fertility and work responses vary across the population in ways suggesting that both cash transfers and job protection are relevant. Increasing parental leave for a future child increases fertility strongly but leaves short-run postbirth careers relatively unaffected. Partially reversing the 1990 extension, a second 1996 reform improves employment and earnings while compressing the time between births.</p>","Lalive, Rafael Zweimüller, Josef",10.1162/qjec.2009.124.3.1363,The Quarterly Journal of Economics,https://academic.oup.com/qje/article-pdf/124/3/1363/5377856/124-3-1363.pdf,2009/08/01,How Does Parental Leave Affect Fertility and Return to Work? Evidence from Two Natural Experiments,https://academic.oup.com/qje/article/124/3/1363/1905162/How-Does-Parental-Leave-Affect-Fertility-and,2009,92
250,"<p>Previous work has addressed the relative vulnerability of different auction schemes to collusive bidding. The common wisdom is that ascending-bid and second-price auctions are highly susceptible to collusion. We show that the details of ascending-bid and second-price auctions, including bidder registration procedures and procedures for information revelation during the auction, can be designed to completely inhibit, or unintentionally facilitate, certain types of collusion. If auctions are designed without acknowledging the possibility of collusion then the design will ignore key features that impact the potential success of colluding bidders.</p>","Marshall, Robert C. Marx, Leslie M.",10.1162/qjec.2009.124.2.883,The Quarterly Journal of Economics,https://academic.oup.com/qje/article-pdf/124/2/883/11105006/124-2-883.pdf,2009/05/01,The Vulnerability of Auctions to Bidder Collusion,https://academic.oup.com/qje/article/124/2/883/1905128/The-Vulnerability-of-Auctions-to-Bidder-Collusion,2009,93
252,"<p>Suresh de Mel, David McKenzie, and Christopher Woodruff's article in the November 2008 issue of this Journal (volume 123, number 4, pages 1329–1372) contains an error. In the abstract, the average real return to capital is 4.6–5.3 percent per month (55–63 percent per year). The corrected abstract is below.</p> <p><strong>Abstract</strong></p> <p>We use randomized grants to generate shocks to capital stock for a set of Sri Lankan microenterprises. We find the average real return to capital in these enterprises is 4.6%–5.3% per month (55%–63% per year), substantially higher than market interest rates. We then examine the heterogeneity of treatment effects. Returns are found to vary with entrepreneurial ability and with household wealth, but not to vary with measures of risk aversion or uncertainty. Treatment impacts are also significantly larger for enterprises owned by males; indeed, we find no positive return in enterprises owned by females.</p>","de Mel, Suresh McKenzie, David Woodruff, Christopher",10.1162/qjec.2009.124.1.423,The Quarterly Journal of Economics,https://academic.oup.com/qje/article-pdf/124/1/423/5340679/124-1-423.pdf,2009/02/01,Returns to Capital in Microenterprises: Evidence from a Field Experiment,https://academic.oup.com/qje/article/124/1/423/1890372/Returns-to-Capital-in-Microenterprises-Evidence,2009,94
253,"<p>Women's choices appear to emphasize child welfare more than those of men. This paper presents new evidence on how suffrage rights for American women helped children to benefit from the scientific breakthroughs of the bacteriological revolution. Consistent with standard models of electoral competition, suffrage laws were followed by immediate shifts in legislative behavior and large, sudden increases in local public health spending. This growth in public health spending fueled large-scale door-to-door hygiene campaigns, and child mortality declined by 8–15% (or 20,000 annual child deaths nationwide) as cause-specific reductions occurred exclusively among infectious childhood killers sensitive to hygienic conditions.</p>","Miller, Grant",10.1162/qjec.2008.123.3.1287,The Quarterly Journal of Economics,https://academic.oup.com/qje/article-pdf/123/3/1287/5434831/123-3-1287.pdf,2008/08/01,"Women's Suffrage, Political Responsiveness, and Child Survival in American History",https://academic.oup.com/qje/article/123/3/1287/1928181/Women-s-Suffrage-Political-Responsiveness-and,2008,95
254,"<p>Recently economists have begun to consider the causes and consequences of religious participation. An unanswered question in this literature is the effect upon individuals of changes in the opportunity cost of religious participation. In this paper we identify a policy-driven change in the opportunity cost of religious participation based on state laws that prohibit retail activity on Sunday, known as “blue laws.” Many states have repealed these laws in recent years, raising the opportunity cost of religious participation. We use a variety of data sets to show that when a state repeals its blue laws religious attendance falls and that church donations and spending fall as well. These results do not seem to be driven by declines in religiosity prior to the law change, nor do we see comparable declines in membership in or giving to nonreligious organizations after a state repeals its laws. We then assess the effects of changes in these laws on drinking and drug use behavior in the NLSY. We find that repealing blue laws leads to an increase in drinking and drug use and that this increase is found only among the initially religious individuals who were affected by the blue laws. The effect is economically significant; for example, the gap in heavy drinking between religious and nonreligious individuals falls by about half after the laws are repealed.</p>","Gruber, Jonathan Hungerman, Daniel M.",10.1162/qjec.2008.123.2.831,The Quarterly Journal of Economics,https://academic.oup.com/qje/article-pdf/123/2/831/5441198/123-2-831.pdf,2008/05/01,The Church Versus the Mall: What Happens When Religion Faces Increased Secular Competition?,https://academic.oup.com/qje/article/123/2/831/1930888/The-Church-Versus-the-Mall-What-Happens-When,2008,96
255,"<p>We are grateful to Foote and Goetz for noting that the final table of Donohue and Levitt (<em>Quarterly Journal of Economics</em>, 116 (2001), 379–420) inadvertently omitted state-year interactions. Correcting our mistake does not alter the sign or statistical significance of our estimates, although it does reduce their magnitude. Using a more carefully constructed measure of abortion that better links birth cohorts to abortion exposure (by using abortion data by state of residence rather than of occurrence, by adjusting for cross-state mobility, and by more precisely estimating birth years from age of arrest data), we present new evidence that abortion legalization reduces crime through both a cohort-size and a selection effect.</p>","Donohue, John J. Levitt, Steven D.",10.1162/qjec.2008.123.1.425,The Quarterly Journal of Economics,https://academic.oup.com/qje/article-pdf/123/1/425/5339203/123-1-425.pdf,2008/02/01,"Measurement Error, Legalized Abortion, and the Decline in Crime: A Response to Foote and Goetz",https://academic.oup.com/qje/article/123/1/425/1889836/Measurement-Error-Legalized-Abortion-and-the,2008,97
256,"<p>How should the tax rate and the level of public debt adjust to an adverse fiscal shock? What is the optimal maturity structure of public debt? If the maturity structure is carefully chosen, the ex post variation in the market value of public debt can cover the government against the need to raise taxes or debt if fiscal conditions should turn bad. In general, almost every Arrow-Debreu allocation can be implemented with noncontingent debt of different maturities. In a stylized example, the optimal policy is implemented by selling a perpetuity and investing in a short-term asset.</p>","Angeletos, George-Marios",10.1162/003355302760193977,The Quarterly Journal of Economics,https://academic.oup.com/qje/article-pdf/117/3/1105/5446374/117-3-1105.pdf,2002/08/01,Fiscal Policy with Noncontingent Debt and the Optimal Maturity Structure,https://academic.oup.com/qje/article/117/3/1105/1932966/Fiscal-Policy-with-Noncontingent-Debt-and-the,2002,98
257,"<p>Sex ratios, i.e., relative numbers of men and women, can affect marriage prospects, labor force participation, and other social and economic variables. But the observed association between sex ratios and social and economic conditions may be confounded by omitted variables and reverse causality. This paper uses variation in immigrant flows as a natural experiment to study the effect of sex ratios on the children and grandchildren of immigrants. The flow of immigrants affected the second-generation marriage market because second-generation marriages were mostly endogamous, i.e., to members of the same ethnic group. The empirical results suggest that high sex ratios had a large positive effect on the likelihood of female marriage, and a large negative effect on female labor force participation. Perhaps surprisingly, the marriage rates of second-generation men appear to be a slightly increasing function of immigrant sex ratios. Higher sex ratios also appear to have raised male earnings and the incomes of parents with young children. The empirical results are broadly consistent with theories where higher sex ratios increase female bargaining power in the marriage market.</p>","Angrist, Josh",10.1162/003355302760193940,The Quarterly Journal of Economics,https://academic.oup.com/qje/article-pdf/117/3/997/5446587/117-3-997.pdf,2002/08/01,How Do Sex Ratios Affect Marriage and Labor Markets? Evidence from America's Second Generation,https://academic.oup.com/qje/article/117/3/997/1933067/How-Do-Sex-Ratios-Affect-Marriage-and-Labor,2002,99
259,"<p>This paper studies the structure of the employment relationship in organizations. It investigates the trade-off firms face between making commitments to their workforce as a whole (multilateral relational contracts), and making more limited commitments to individuals or smaller groups of employees (bilateral relational contracts). Multilateral contracts bind the firm more strongly to implicit commitments, improving motivation, but are difficult to adjust in response to changes in the environment. Bilateral contracts make workforce changes easier to implement. The framework helps to explain the use of relative performance evaluation, why firms rely on temporary employees, and the adoption of two-tier workforces.</p>","Levin, Jonathan",10.1162/003355302760193968,The Quarterly Journal of Economics,https://academic.oup.com/qje/article-pdf/117/3/1075/5446320/117-3-1075.pdf,2002/08/01,Multilateral Contracting and the Employment Relationship,https://academic.oup.com/qje/article/117/3/1075/1932944/Multilateral-Contracting-and-the-Employment,2002,100
261,"<p>This paper analyzes optimal income transfers for low incomes. Labor supply responses are modeled along the intensive margin (intensity of work on the job) and along the extensive margin (participation into the labor force). When behavioral responses are concentrated along the intensive margin, the optimal transfer program is a classical Negative Income Tax program with a substantial guaranteed income support and a large phasing-out tax rate. However, when behavioral responses are concentrated along the extensive margin, the optimal transfer program is similar to the Earned Income Tax Credit with negative marginal tax rates at low income levels and a small guaranteed income. Carefully calibrated numerical simulations are provided.</p>","Saez, Emmanuel",10.1162/003355302760193959,The Quarterly Journal of Economics,https://academic.oup.com/qje/article-pdf/117/3/1039/5446297/117-3-1039.pdf,2002/08/01,Optimal Income Transfer Programs: Intensive versus Extensive Labor Supply Responses,https://academic.oup.com/qje/article/117/3/1039/1932939/Optimal-Income-Transfer-Programs-Intensive-versus,2002,101
262,"<p>This paper investigates individual motives to participate in rotating savings and credit associations (roscas). Detailed evidence from roscas in a Kenyan slum (Nairobi) suggests that most roscas are predominantly composed of women, particularly those living in a couple and earning an independent income. We propose an explanation of this based on conflictual interactions within the household. Participation in a rosea is a strategy a wife employs to protect her savings against claims by her husband for immediate consumption. The empirical implications of the model are then tested using the data collected in Kenya.</p>","Anderson, Siwan Baland, Jean-Marie",10.1162/003355302760193931,The Quarterly Journal of Economics,https://academic.oup.com/qje/article-pdf/117/3/963/5446554/117-3-963.pdf,2002/08/01,The Economics of Roscas and Intrahousehold Resource Allocation,https://academic.oup.com/qje/article/117/3/963/1933053/The-Economics-of-Roscas-and-Intrahousehold,2002,102
263,"<p>The last three decades have witnessed the rise of a pohtical gender gap in the United States wherein more women than men favor the Democratic party. We trace this development to the decline in marriage, which we posit has made men richer and women poorer. Data for the United States support this argument. First, there is a strong positive correlation between state divorce prevalence and the political gender gap—higher divorce prevalence reduces support for the Democrats among men but not women. Second, longitudinal data show that following marriage (divorce), women are less (more) likely to support the Democratic party.</p>","Edlund, Lena Pande, Rohini",10.1162/003355302760193922,The Quarterly Journal of Economics,https://academic.oup.com/qje/article-pdf/117/3/917/5446524/117-3-917.pdf,2002/08/01,Why Have Women Become Left-Wing? The Political Gender Gap and the Decline in Marriage,https://academic.oup.com/qje/article/117/3/917/1933043/Why-Have-Women-Become-Left-Wing-The-Political,2002,103
264,"<p>Departures from self-interest in economic experiments have recently inspired models of “social preferences.” We design a range of simple experimental games that test these theories more directly than existing experiments. Our experiments show that subjects are more concerned with increasing social welfare—sacrificing to increase the payoffs for all recipients, especially low-payoff recipients—than with reducing differences in payoffs (as supposed in recent models). Subjects are also motivated by reciprocity: they withdraw willingness to sacrifice to achieve a fair outcome when others are themselves unwilling to sacrifice, and sometimes punish unfair behavior.</p>","Charness, Gary Rabin, Matthew",10.1162/003355302760193904,The Quarterly Journal of Economics,https://academic.oup.com/qje/article-pdf/117/3/817/5446466/117-3-817.pdf,2002/08/01,Understanding Social Preferences with Simple Tests,https://academic.oup.com/qje/article/117/3/817/1933015/Understanding-Social-Preferences-with-Simple-Tests,2002,104
265,"<p>We analyze the value placed by rational agents on self-confidence, and the strategies employed in its pursuit. Confidence in one's abilities generally enhances motivation, making it a valuable asset for individuals with imperfect willpower. This demand for self-serving beliefs (which can also arise from hedonic or signaling motives) must be weighed against the risks of overconfidence. On the supply side, we develop a model of self-deception through endogenous memory that reconciles the motivated and rational features of human cognition. The resulting intrapersonal game of strategic communication typically leads to multiple equilibria. While “positive thinking” can improve welfare, it can also be self-defeating (and nonetheless pursued).</p>","Bénabou, Roland Tirole, Jean",10.1162/003355302760193913,The Quarterly Journal of Economics,https://academic.oup.com/qje/article-pdf/117/3/871/5446496/117-3-871.pdf,2002/08/01,Self-Confidence and Personal Motivation,https://academic.oup.com/qje/article/117/3/871/1933029/Self-Confidence-and-Personal-Motivation,2002,105
