,abstract,author,doi,journal,pdf_url,publication_date,title,url,year,index
409,"<p>We analyze yield spreads on sovereign bonds issued by emerging markets, using modern data from the 1990s and newly collected historical data on bonds traded in London during 1870–1913, a previous era of global capital market integration. We show that spreads today comove across emerging markets to a significantly higher degree than they did in the historical sample. Moreover, sharp changes in spreads in the 1990s tend to be mostly related to global events, whereas they were primarily related to country-specific events in 1870–1913. Although we find that fundamentals comove somewhat more strongly today than they did in the past, we conjecture that today's investors pay less attention to country-specific events than their predecessors did.</p>","Mauro, Paolo Sussman, Nathan Yafeh, Yishay",10.1162/003355302753650364,The Quarterly Journal of Economics,https://academic.oup.com/qje/article-pdf/117/2/695/5324239/117-2-695.pdf,2002/05/01,Emerging Market Spreads: Then versus Now,https://academic.oup.com/qje/article/117/2/695/1883946/Emerging-Market-Spreads-Then-versus-Now,2002,166
410,"<p>This paper provides a quantitative theory for the recent rise in residual wage inequality consistent with the empirical observation that a sizable part of this increase has a transitory nature, a feature that eludes standard models based on ex ante heterogeneity in ability. An acceleration in the rate of quality improvement of equipment, like the one observed from the early 1970s, increases the productivity/quality differentials across machines (jobs). In a frictional labor market, this force translates into higher wage dispersion even among ex ante equal workers. With vintage-human capital, the acceleration reduces workers' capacity to transfer skills from old to new machines, generating a rise in the cross-sectional variance of skills, and therefore of wages. Through calibration, the paper shows that this mechanism can account for 30 percent of the surge in residual inequality in the U. S. economy (or for most of its transitory component). Two key implications of the theory—faster within-job wage growth and larger wage losses upon displacement—find empirical support in the data.</p>","Violante, Giovanni L.",10.1162/003355302753399517,The Quarterly Journal of Economics,https://academic.oup.com/qje/article-pdf/117/1/297/5238359/117-1-297.pdf,2002/02/01,"Technological Acceleration, Skill Transferability, and the Rise in Residual Inequality",https://academic.oup.com/qje/article/117/1/297/1851767/Technological-Acceleration-Skill-Transferability,2002,167
411,"<p>We explore the effectiveness of matching grants when lower levels of government can expropriate some of the funds for other uses. Using data on the Medicaid Disproportionate Share program, we identify states that were most able to expropriate funds. Payments to public hospitals in these states were systematically diverted and had no significant impact on patient mortality. Payments that were not expropriated were associated with significant declines in patient mortality. Overall, subsidies were an effective mechanism for improving outcomes for the poor, but the impact was limited by the ability of state and local governments to divert the targeted funds.</p>","Baicker, Katherine Staiger, Douglas",10.1162/0033553053327461,The Quarterly Journal of Economics,https://academic.oup.com/qje/article-pdf/120/1/345/5442599/120-1-345.pdf,2005/02/01,"Fiscal Shenanigans, Targeted Federal Health Care Funds, and Patient Mortality",https://academic.oup.com/qje/article/120/1/345/1931466/Fiscal-Shenanigans-Targeted-Federal-Health-Care,2005,168
412,"<p>Structural vector autoregressions (VARs) are widely used to trace out the effect of monetary policy innovations on the economy. However, the sparse information sets typically used in these empirical models lead to at least three potential problems with the results. First, to the extent that central banks and the private sector have information not reflected in the VAR, the measurement of policy innovations is likely to be contaminated. Second, the choice of a specific data series to represent a general economic concept such as “real activity” is often arbitrary to some degree. Third, impulse responses can be observed only for the included variables, which generally constitute only a small subset of the variables that the researcher and policy-maker care about. In this paper we investigate one potential solution to this limited information problem, which combines the standard structural VAR analysis with recent developments in factor analysis for large data sets. We find that the information that our factor-augmented VAR (FAVAR) methodology exploits is indeed important to properly identify the monetary transmission mechanism. Overall, our results provide a comprehensive and coherent picture of the effect of monetary policy on the economy.</p>","Bernanke, Ben S. Boivin, Jean Eliasz, Piotr",10.1162/0033553053327452,The Quarterly Journal of Economics,https://academic.oup.com/qje/article-pdf/120/1/387/5442603/120-1-387.pdf,2005/02/01,Measuring the Effects of Monetary Policy: A Factor-Augmented Vector Autoregressive (FAVAR) Approach,https://academic.oup.com/qje/article/120/1/387/1931468/Measuring-the-Effects-of-Monetary-Policy-A-Factor,2005,169
413,"<p>This paper examines the interactions between household formation, inequality, and per capita income. We develop a model in which agents decide to become skilled or unskilled and form households. We show that the equilibrium sorting of spouses by skill type (their correlation in skills) is an increasing function of the skill premium. In the absence of perfect capital markets, the economy can converge to different steady states, depending upon initial conditions. The degree of marital sorting and wage inequality is positively correlated across steady states and negatively correlated with per capita income. We use household surveys from 34 countries to construct several measures of the skill premium and of the degree of correlation of spouses' education (marital sorting). For all our measures, we find a positive and significant relationship between the two variables. We also find that sorting and per capita GDP are negatively correlated and that greater discrimination against women leads to more sorting, in line with the predictions of our model.</p>","Fernández, Raquel Guner, Nezih Knowles, John",10.1162/0033553053327498,The Quarterly Journal of Economics,https://academic.oup.com/qje/article-pdf/120/1/273/5442593/120-1-273.pdf,2005/02/01,Love and Money: A Theoretical and Empirical Analysis of Household Sorting and Inequality,https://academic.oup.com/qje/article/120/1/273/1931463/Love-and-Money-A-Theoretical-and-Empirical,2005,170
414,"<p>We present an argument for changes in the franchise in which an elite split along economic interests uses the suffrage to influence implemented policies. Through the influence of these policies on the character of industrialization, we analyze the effects of franchise changes on economic growth. We identify in the social structure of society an explanation for the connection between enfranchisement and growth: when (1) there exists an economic conflict among the elite, (2) landed classes are not politically strong, and (3) there exists a critical mass of industrial workers, we observe both growth and democratization. The lack of conditions (1) or (2) resolves in stagnant autocracies while the absence of condition (3) drives growth-deterring democratic expansions. We provide historical support for our argument by analyzing the experience of eleven countries.</p>","Llavador, Humberto Oxoby, Robert J.",10.1093/qje/120.3.1155,The Quarterly Journal of Economics,https://academic.oup.com/qje/article-pdf/120/3/1155/5211016/120-3-1155.pdf,2005/08/01,"Partisan Competition, Growth, and the Franchise",https://academic.oup.com/qje/article/120/3/1155/1841475/Partisan-Competition-Growth-and-the-Franchise,2005,171
415,"<p>We investigate the hypothesis that the combination of three related innovations—1) information technology (IT), 2) complementary workplace reorganization, and 3) new products and services—constitute a significant skill-biased technical change affecting labor demand in the United States. Using detailed firm-level data, we find evidence of complementarities among all three of these innovations in factor demand and productivity regressions. In addition, firms that adopt these innovations tend to use more skilled labor. The effects of IT on labor demand are greater when IT is combined with the particular organizational investments we identify, highlighting the importance of IT-enabled organizational change.</p>","Bresnahan, Timothy F. Brynjolfsson, Erik Hitt, Lorin M.",10.1162/003355302753399526,The Quarterly Journal of Economics,https://academic.oup.com/qje/article-pdf/117/1/339/5238361/117-1-339.pdf,2002/02/01,"Information Technology, Workplace Organization, and the Demand for Skilled Labor: Firm-Level Evidence",https://academic.oup.com/qje/article/117/1/339/1851770/Information-Technology-Workplace-Organization-and,2002,172
416,"<p>The conventional wisdom that homeownership is very risky ignores the fact that the alternative, renting, is also risky. Owning a house provides a hedge against fluctuations in housing costs, but in turn introduces asset price risk. In a simple model of tenure choice with endogenous house prices, we show that the <em>net</em> risk of owning declines with a household's expected horizon in its house and with the correlation in housing costs in future locations. Empirically, we find that both house prices, relative to rents, and the probability of homeownership increase with net rent risk.</p>","Sinai, Todd Souleles, Nicholas S.",10.1093/qje/120.2.763,The Quarterly Journal of Economics,https://academic.oup.com/qje/article-pdf/120/2/763/5449046/120-2-763.pdf,2005/05/01,Owner-Occupied Housing as a Hedge Against Rent Risk,https://academic.oup.com/qje/article/120/2/763/1933972/Owner-Occupied-Housing-as-a-Hedge-Against-Rent,2005,173
417,"<p>In this paper we examine the role of social security in an economy populated by overlapping generations of individuals with time-inconsistent preferences who face mortality risk, individual income risk, and borrowing constraints. We find that unfunded social security lowers the capital stock, output, and consumption for consumers with time-consistent or time-inconsistent preferences. However, it may raise or lower welfare depending on the strength of time inconsistency.</p>","İmrohoroğlu, Ayşe İmrohoroğlu, Selahattin Joines, Douglas H.",10.1162/003355303321675509,The Quarterly Journal of Economics,https://academic.oup.com/qje/article-pdf/118/2/745/5364260/118-2-745.pdf,2003/05/01,Time-Inconsistent Preferences and Social Security,https://academic.oup.com/qje/article/118/2/745/1899606/Time-Inconsistent-Preferences-and-Social-Security,2003,174
418,"<p>The 1981–1982 recession induced substantial variation across sites in air pollution reductions. This is used to estimate the impact of total suspended particulates (TSPs) on infant mortality. We find that a 1-percent reduction in TSPs results in a 0.35 percent decline in the infant mortality rate at the county level, implying that 2500 fewer infants died from 1980–1982 than would have in the absence of the TSPs reductions. Most of these effects are driven by fewer deaths occurring within one month of birth, suggesting that fetal exposure is a potential pathophysiologic mechanism. The analysis also reveals nonlinear effects of TSPs pollution and greater sensitivity of black infant mortality at the county level. Importantly, the estimates are stable across a variety of specifications.</p>","Chay, Kenneth Y. Greenstone, Michael",10.1162/00335530360698513,The Quarterly Journal of Economics,https://academic.oup.com/qje/article-pdf/118/3/1121/5472903/118-3-1121.pdf,2003/08/01,The Impact of Air Pollution on Infant Mortality: Evidence from Geographic Variation in Pollution Shocks Induced by a Recession,https://academic.oup.com/qje/article/118/3/1121/1942999/The-Impact-of-Air-Pollution-on-Infant-Mortality,2003,175
421,"<p>This study develops theory and uses a door-to-door fund-raising field experiment to explore the economics of charity. We approached nearly 5000 households, randomly divided into four experimental treatments, to shed light on key issues on the demand side of charitable fund-raising. Empirical results are in line with our theory: in gross terms, the lotteries raised more money than the voluntary contributions treatments. Interestingly, in terms of both maximizing current contributions and inducing participation, we find that a one-standard deviation increase in female solicitor physical attractiveness is similar to that ofthe lottery incentive.</p>","Landry, Craig E. Lange, Andreas List, John A. Price, Michael K. Rupp, Nicholas G.",10.1162/qjec.2006.121.2.747,The Quarterly Journal of Economics,https://academic.oup.com/qje/article-pdf/121/2/747/5324484/121-2-747.pdf,2006/05/01,Toward an Understanding of the Economics of Charity: Evidence from a Field Experiment,https://academic.oup.com/qje/article/121/2/747/1884044/Toward-an-Understanding-of-the-Economics-of,2006,176
423,"<p>Recent HIV treatment breakthroughs have lowered HIV mortality in the United States, but have also coincided with increased HIV incidence. We argue that these trends are causally linked, because new treatments have improved health and survival for the HIV +, increased their sexual activity, and thus facilitated HIV's spread. Using variation in state-level Medicaid eligibility rules as an instrument for HIV treatment, we find that treating HIV + individuals more than doubles their number of sex partners. A change of this magnitude would increase infection risk by at least 44 percent for the HIV-negative and likely have lowered their expected welfare.</p>","Lakdawalla, Darius Sood, Neeraj Goldman, Dana",10.1162/qjec.121.3.1063,The Quarterly Journal of Economics,https://academic.oup.com/qje/article-pdf/121/3/1063/5408925/121-3-1063.pdf,2006/08/01,HIV Breakthroughs and Risky Sexual Behavior,https://academic.oup.com/qje/article/121/3/1063/1917864/HIV-Breakthroughs-and-Risky-Sexual-Behavior,2006,177
424,"<p>Restaurant prices in the euro area increased dramatically after the introduction of the euro. We show that this increase can be explained by a common menu cost model, extended to include a state-dependent decision of firms on when to adopt the new currency. Two mechanisms drive this result. First, firms concentrate otherwise staggered price increases around the changeover. Second, before the adoption of the euro, prices do not reflect the marginal cost increases expected to occur after the changeover. This “horizon effect” disappears as soon as the new currency is adopted, causing a jump in the optimal price.</p>","Hobijn, Bart Ravenna, Federico Tambalotti, Andrea",10.1162/qjec.121.3.1103,The Quarterly Journal of Economics,https://academic.oup.com/qje/article-pdf/121/3/1103/5408947/121-3-1103.pdf,2006/08/01,Menu Costs at Work: Restaurant Prices and the Introduction of the Euro,https://academic.oup.com/qje/article/121/3/1103/1917869/Menu-Costs-at-Work-Restaurant-Prices-and-the,2006,178
425,"<p>Recent immigrants tend to locate in ethnic “enclaves” within metropolitan areas. The economic consequence of living in such enclaves is still an unresolved issue. We use data from an immigrant policy initiative in Sweden, when government authorities distributed refugee immigrants across locales in a way that we argue is exogenous. This policy initiative provides a unique natural experiment, which allows us to estimate the causal effect on labor market outcomes of living in enclaves. We find substantive evidence of sorting across locations. When sorting is taken into account, living in enclaves improves labor market outcomes for less skilled immigrants: the earnings gain associated with a standard deviation increase in ethnic concentration is 13 percent. Furthermore, the quality of the enclave seems to matter. Members of high-income ethnic groups gain more from living in an enclave than members of low-income ethnic groups.</p>","Edin, Per-Anders Fredriksson, Peter Åslund, Olof",10.1162/00335530360535225,The Quarterly Journal of Economics,https://academic.oup.com/qje/article-pdf/118/1/329/5406960/118-1-329.pdf,2003/02/01,Ethnic Enclaves and the Economic Success of Immigrants—Evidence from a Natural Experiment,https://academic.oup.com/qje/article/118/1/329/1917042/Ethnic-Enclaves-and-the-Economic-Success-of,2003,179
426,"<p>We use data on life insurance contracts to study the properties of long-term contracts in a world where buyers cannot commit to a contract. The data are especially suited to test a theory of dynamic contracting since they include information on the entire profile of future premiums. All the patterns in the data fit the theoretical predictions of a model with symmetric learning and one-sided commitment à la Harris and Holmstom. The lack of commitment by consumers shapes contracts in the way predicted by the theory: all contracts involve front-loading (prepayment) of premiums. Front-loading generates a partial lock-in of consumers; more front-loading is associated with lower lapsation. Moreover, contracts that are more front-loaded have a lower present value of premiums over the period of coverage. This is consistent with the idea that front-loading enhances consumer commitment and that more front-loaded contracts retain better risk pools.</p>","Hendel, Igal Lizzeri, Alessandro",10.1162/00335530360535216,The Quarterly Journal of Economics,https://academic.oup.com/qje/article-pdf/118/1/299/5406941/118-1-299.pdf,2003/02/01,The Role of Commitment in Dynamic Contracts: Evidence from Life Insurance,https://academic.oup.com/qje/article/118/1/299/1917037/The-Role-of-Commitment-in-Dynamic-Contracts,2003,180
427,"<p>In many countries, banks lend to firms controlled by the bank's owners. We examine the benefits of related lending using a newly assembled data set for Mexico. Related lending is prevalent (20 percent of commercial loans) and takes place on better terms than arm's-length lending (annual interest rates are 4 percentage points lower). Related loans are 33 percent more likely to default and, when they do, have lower recovery rates (30 percent less) than unrelated ones. The evidence for Mexico in the 1990s supports the view that in some important settings related lending is a manifestation of looting.</p>","La Porta, Rafael Lopez-de-Silanes, Florencio Zamarripa, Guillermo",10.1162/00335530360535199,The Quarterly Journal of Economics,https://academic.oup.com/qje/article-pdf/118/1/231/5406924/118-1-231.pdf,2003/02/01,Related Lending,https://academic.oup.com/qje/article/118/1/231/1917028/Related-Lending,2003,181
428,"<p>Economists have long emphasized the importance of expectations in determining macroeconomic outcomes. Yet there has been almost no recent effort to model actual empirical expectations data; instead, macroeconomists usually simply assume that expectations are “rational.” This paper shows that while empirical household expectations are not rational in the usual sense, expectational dynamics are well captured by a model in which households' views derive from news reports of the views of professional forecasters, which in turn may be rational. The model's estimates imply that people only occasionally pay attention to news reports; this inattention generates “stickyness” in aggregate expectations, with important macroeconomic consequences.</p>","Carroll, Christopher D.",10.1162/00335530360535207,The Quarterly Journal of Economics,https://academic.oup.com/qje/article-pdf/118/1/269/5406935/118-1-269.pdf,2003/02/01,Macroeconomic Expectations of Households and Professional Forecasters,https://academic.oup.com/qje/article/118/1/269/1917034/Macroeconomic-Expectations-of-Households-and,2003,182
430,"<p>This paper uses a unique data set on corruption containing quantitative information on bribe payments of Ugandan firms. The data have two striking features: not all firms report that they need to pay bribes, and there is considerable variation in reported graft across firms facing similar institutions/policies. We propose an explanation for these patterns, based on differences in control rights and bargaining strength across firms. Consistent with the control rights/bargaining hypotheses, we find that the incidence of corruption can be explained by the variation in policies/regulations across industries. How much must bribe-paying firms pay? Combining the quantitative data on corruption with detailed financial information from the surveyed firms, we show that firms' “ability to pay” and firms' “refusal power” can explain a large part of the variation in bribes across graft-reporting firms. These results suggest that public officials act as price (bribe) discriminators, and that prices of public services are partly determined in order to extract bribes.</p>","Svensson, Jakob",10.1162/00335530360535180,The Quarterly Journal of Economics,https://academic.oup.com/qje/article-pdf/118/1/207/5406902/118-1-207.pdf,2003/02/01,Who Must Pay Bribes and How Much? Evidence from a Cross Section of Firms,https://academic.oup.com/qje/article/118/1/207/1917026/Who-Must-Pay-Bribes-and-How-Much-Evidence-from-a,2003,183
431,"<p>Shareholder rights vary across firms. Using the incidence of 24 governance rules, we construct a “Governance Index” to proxy for the level of shareholder rights at about 1500 large firms during the 1990s. An investment strategy that bought firms in the lowest decile of the index (strongest rights) and sold firms in the highest decile of the index (weakest rights) would have earned abnormal returns of 8.5 percent per year during the sample period. We find that firms with stronger shareholder rights had higher firm value, higher profits, higher sales growth, lower capital expenditures, and made fewer corporate acquisitions.</p>","Gompers, Paul Ishii, Joy Metrick, Andrew",10.1162/00335530360535162,The Quarterly Journal of Economics,https://academic.oup.com/qje/article-pdf/118/1/107/5406871/118-1-107.pdf,2003/02/01,Corporate Governance and Equity Prices,https://academic.oup.com/qje/article/118/1/107/1917018/Corporate-Governance-and-Equity-Prices,2003,184
432,"<p>In six experiments we show that initial valuations of familiar products and simple hedonic experiences are strongly influenced by arbitrary “anchors” (sometimes derived from a person's social security number). Because subsequent valuations are also coherent with respect to salient differences in perceived quality or quantity of these products and experiences, the entire pattern of valuations can easily create an illusion of order, as if it is being generated by stable underlying preferences. The experiments show that this combination of <em>coherent arbitrariness</em> (1) cannot be interpreted as a rational response to information, (2) does not decrease as a result of experience with a good, (3) is not necessarily reduced by market forces, and (4) is not unique to cash prices. The results imply that demand curves estimated from market data need not reveal true consumer preferences, in any normatively significant sense of the term.</p>","Ariely, Dan Loewenstein, George Prelec, Drazen",10.1162/00335530360535153,The Quarterly Journal of Economics,https://academic.oup.com/qje/article-pdf/118/1/73/5406980/118-1-73.pdf,2003/02/01,“Coherent Arbitrariness”: Stable Demand Curves Without Stable Preferences,https://academic.oup.com/qje/article/118/1/73/1917051/Coherent-Arbitrariness-Stable-Demand-Curves,2003,185
433,"<p>This study examines individual behavior in two well-functioning marketplaces to investigate whether market experience eliminates the endowment effect. Field evidence from both markets suggests that individual behavior converges to the neoclassical prediction as market experience increases. In an experimental test of whether these observations are due to treatment (market experience) or selection (e.g., static preferences), I find that market experience plays a significant role in eliminating the endowment effect. I also find that these results are robust to institutional change and extend beyond the two marketplaces studied. Overall, this study provides strong evidence that market experience eliminates an important market anomaly.</p>","List, John A.",10.1162/00335530360535144,The Quarterly Journal of Economics,https://academic.oup.com/qje/article-pdf/118/1/41/5406962/118-1-41.pdf,2003/02/01,Does Market Experience Eliminate Market Anomalies?,https://academic.oup.com/qje/article/118/1/41/1917048/Does-Market-Experience-Eliminate-Market-Anomalies,2003,186
